{
  "$schema": "semantic-topology-deep-search-inventory.schema.json",
  "counts": {
    "completed": 96,
    "error": 4
  },
  "inventory_sha256": "c464a88b1cf2f0347ec709819dfe4c8d87b0399530119115d3441d79c9ef6e2e",
  "inventory_version": 1,
  "materialized_run_count": 100,
  "plan_sha256": "0a0285d0d371aee1b8e3bad94b0936c7b288acd10045fe4b9906cfa54794699d",
  "planned_run_count": 100,
  "protocol_sha256": "1da1f2e260917f1f48efe3cfb8101e315f24608bbd640f56c684e624d1af1cf1",
  "runs": [
    {
      "artifact_path": "runs/0010023c26afd91d1ddf4d48bd5711715f0c2ad61519648a8c7f9a06eeb8dead.json",
      "artifact_sha256": "538d4f603ea89b7377b432edec2e4eb21b76a0085bf1e29a8a317b98497e7740",
      "run_id": "sha256:0010023c26afd91d1ddf4d48bd5711715f0c2ad61519648a8c7f9a06eeb8dead",
      "terminal_status": "completed"
    },
    {
      "artifact_path": "runs/0061265072d21aef1b91da833989b50e9e8a9864e104e1917ade7084688f7266.json",
      "artifact_sha256": "42a34f9ad561bea925dfbe683e1650e6f832f872ab3f41e37458e8c1ed860bf8",
      "run_id": "sha256:0061265072d21aef1b91da833989b50e9e8a9864e104e1917ade7084688f7266",
      "terminal_status": "completed"
    },
    {
      "artifact_path": "runs/02167d2794f802ade78f16a1bb8e217a47873cefd65eee4a205a920b2ac3f861.json",
      "artifact_sha256": "25fad4cf0f4319540b5e4e7b9ad3334232d8f4575708fb27ae210d84ad1194ec",
      "run_id": "sha256:02167d2794f802ade78f16a1bb8e217a47873cefd65eee4a205a920b2ac3f861",
      "terminal_status": "completed"
    },
    {
      "artifact_path": "runs/02e6594035cfa93ce643666c809dd6823e595ec30b0b2cd6abf163028990d91b.json",
      "artifact_sha256": "10f4791346c22e9e96dda6c192aa6d94dea687681e671d454eb13fd24596d020",
      "run_id": "sha256:02e6594035cfa93ce643666c809dd6823e595ec30b0b2cd6abf163028990d91b",
      "terminal_status": "completed"
    },
    {
      "artifact_path": "runs/09406d36f80839b163bfcc718d93bdecfd819d46240733266926b5e3dc0232bc.json",
      "artifact_sha256": "4b7838c5b1bcb72359fe27a69af4298aee18d996b085708f840864721f0466c3",
      "run_id": "sha256:09406d36f80839b163bfcc718d93bdecfd819d46240733266926b5e3dc0232bc",
      "terminal_status": "completed"
    },
    {
      "artifact_path": "runs/0b91fbad0f7010970df4fc261f4b3bde4bdf429ff27402dc57286dd3f32fcf9a.json",
      "artifact_sha256": "a5a7bf383d22399ca922756b2e288fa05546516b667ffe5908cdc550d0b4dc0c",
      "run_id": "sha256:0b91fbad0f7010970df4fc261f4b3bde4bdf429ff27402dc57286dd3f32fcf9a",
      "terminal_status": "completed"
    },
    {
      "artifact_path": "runs/10687aff3d6793820f2266a1afc6998183d7baf8eab00f56eeba7dde8af820fb.json",
      "artifact_sha256": "eee4f1aa9198729be67a7d239966ae179a9c958a15ad5badb2fb1c508a95202e",
      "run_id": "sha256:10687aff3d6793820f2266a1afc6998183d7baf8eab00f56eeba7dde8af820fb",
      "terminal_status": "completed"
    },
    {
      "artifact_path": "runs/10b85f770c4b7e7c909a7959e98513ca25a28277def7bf2e439cd1e5cb844f1c.json",
      "artifact_sha256": "cecc0391f2164d40555c84debbec2a8f93397e013d8a1e0c2cd87beb1c6cec59",
      "run_id": "sha256:10b85f770c4b7e7c909a7959e98513ca25a28277def7bf2e439cd1e5cb844f1c",
      "terminal_status": "completed"
    },
    {
      "artifact_path": "runs/11698e92d603247d96d3b3eee20ab34529415b0f40e111ec9d47f3ffd51b334e.json",
      "artifact_sha256": "6b0185991565d54986e07e9e4bbdae57f40aafc5e2ee4ef34fa2e6a298864256",
      "run_id": "sha256:11698e92d603247d96d3b3eee20ab34529415b0f40e111ec9d47f3ffd51b334e",
      "terminal_status": "completed"
    },
    {
      "artifact_path": "runs/1845b846f3587b58b493b1d0810494a83e8d09707708dd630e8f01073bfbc6d0.json",
      "artifact_sha256": "4826a51f1c03bfb1177fa38de5e9368ff67017cee1932c46944ee167bc8030c9",
      "run_id": "sha256:1845b846f3587b58b493b1d0810494a83e8d09707708dd630e8f01073bfbc6d0",
      "terminal_status": "completed"
    },
    {
      "artifact_path": "runs/1be0a507a4eced9640355abd619d480ffcb4e28ae9b361758b0eefed10e56609.json",
      "artifact_sha256": "2a614d384435b4652ada574470f3a69d0c4de7137c5a26ce042e2f66d358abcf",
      "run_id": "sha256:1be0a507a4eced9640355abd619d480ffcb4e28ae9b361758b0eefed10e56609",
      "terminal_status": "completed"
    },
    {
      "artifact_path": "runs/1cf5fb3139e507561e49e6d12dbb6611c9f668d3c7659559278fb34a664abd91.json",
      "artifact_sha256": "5937d1fd41d1bd7a2633dc17f0680a70e04c4ff347fcadc689d15e02101fd49e",
      "run_id": "sha256:1cf5fb3139e507561e49e6d12dbb6611c9f668d3c7659559278fb34a664abd91",
      "terminal_status": "completed"
    },
    {
      "artifact_path": "runs/1dca8f81736a7bf2a1581f9bc003fe0e2eee11540661ed7d714c8c525a34c3ba.json",
      "artifact_sha256": "8134e687a25eb2c4e5bd72bfa74a086475b6638f8ab33cdcfaa381b527f29e32",
      "run_id": "sha256:1dca8f81736a7bf2a1581f9bc003fe0e2eee11540661ed7d714c8c525a34c3ba",
      "terminal_status": "completed"
    },
    {
      "artifact_path": "runs/1e70525cd36d4d3a6b30fcb06c7bf9a7158f6011bbc05760404fb48ec26e787a.json",
      "artifact_sha256": "d5e63d71582f6f779e9a7d16dc42a1da7d475a1f0a2a8f1bc82b2a8ea8208936",
      "run_id": "sha256:1e70525cd36d4d3a6b30fcb06c7bf9a7158f6011bbc05760404fb48ec26e787a",
      "terminal_status": "completed"
    },
    {
      "artifact_path": "runs/22468373cac05f031658c070979091885f438f3e7bcaef02182996e62d048c1c.json",
      "artifact_sha256": "683fa536d421742b9aa336338755552d926c85c4634a219f8d4c7f765d2525b1",
      "run_id": "sha256:22468373cac05f031658c070979091885f438f3e7bcaef02182996e62d048c1c",
      "terminal_status": "completed"
    },
    {
      "artifact_path": "runs/23dc209604d907c92177df310c44c7cc646437d98f53800ba98986095c72fa2a.json",
      "artifact_sha256": "6daf00d444350976570f0f0044e2be7dcc9453fb9acba4b30548a291ffcc5d6e",
      "run_id": "sha256:23dc209604d907c92177df310c44c7cc646437d98f53800ba98986095c72fa2a",
      "terminal_status": "completed"
    },
    {
      "artifact_path": "runs/281a4d8f56f901065df010d58c0f7a6628c29349f3b662e26cdc61be79cd0235.json",
      "artifact_sha256": "3b9cd647daf5c4e91b760f29e17c5c2dadf69096122bec3f785b4f4941da4f2b",
      "run_id": "sha256:281a4d8f56f901065df010d58c0f7a6628c29349f3b662e26cdc61be79cd0235",
      "terminal_status": "completed"
    },
    {
      "artifact_path": "runs/2cb4bfeeb1bd2c293b23658529b54ae68e8fb8fd4108794abb3aeecd1e76e367.json",
      "artifact_sha256": "8397141eab552ad2dc88f051f1d0df58696997355667888871f6211fc20a1049",
      "run_id": "sha256:2cb4bfeeb1bd2c293b23658529b54ae68e8fb8fd4108794abb3aeecd1e76e367",
      "terminal_status": "completed"
    },
    {
      "artifact_path": "runs/33567e7a42aa91a89ecd8cff3f8c01b9d4ee8e7b242d0223223e5c32d2a99364.json",
      "artifact_sha256": "c7cc24a0f4bb99a5050e3ead6b5db11bb76fbaffae49253c77fda94f842c02c1",
      "run_id": "sha256:33567e7a42aa91a89ecd8cff3f8c01b9d4ee8e7b242d0223223e5c32d2a99364",
      "terminal_status": "completed"
    },
    {
      "artifact_path": "runs/36efdf4245cc9250d0f206cb789bd90629e8762b3e3387109ba68cc840c55c2c.json",
      "artifact_sha256": "86c144662dd7350e6260081a7ac16b0163147a2aafc2772106c361b1f3a56bdf",
      "run_id": "sha256:36efdf4245cc9250d0f206cb789bd90629e8762b3e3387109ba68cc840c55c2c",
      "terminal_status": "completed"
    },
    {
      "artifact_path": "runs/3891f53e42702795edafaaf480358bb38e87ed17cc05c412621b28b93232080c.json",
      "artifact_sha256": "4cdf425dc194555151a3944cabba28eb1d80aa49bcad714b083bd43703d3efc5",
      "run_id": "sha256:3891f53e42702795edafaaf480358bb38e87ed17cc05c412621b28b93232080c",
      "terminal_status": "completed"
    },
    {
      "artifact_path": "runs/3fdd8e617f26097d859cee26cb4f1834e4b0a5e4e0e446a04d203a1057ad6328.json",
      "artifact_sha256": "58c0a5b725f489a8c33ff0543bd86111c135b48d5f94ff6c2cb648dbf2f91832",
      "run_id": "sha256:3fdd8e617f26097d859cee26cb4f1834e4b0a5e4e0e446a04d203a1057ad6328",
      "terminal_status": "completed"
    },
    {
      "artifact_path": "runs/473f80b56af5cd0d7ccb3b36a3464d0057b15a8339d3e61f3667fc480e35ac82.json",
      "artifact_sha256": "8f5cf5dd7024233a56d4638c2afcfb50c945eab4aa8f4ffcde4ea6c6aded388e",
      "run_id": "sha256:473f80b56af5cd0d7ccb3b36a3464d0057b15a8339d3e61f3667fc480e35ac82",
      "terminal_status": "completed"
    },
    {
      "artifact_path": "runs/4a03d52e6585ce9debb0ce864f9771237d7dde20670b45b4917f5e67cf8fb0fa.json",
      "artifact_sha256": "8b0a8eaa00fa063927aec8158491558d4acd78788630963365c0668a8981b271",
      "run_id": "sha256:4a03d52e6585ce9debb0ce864f9771237d7dde20670b45b4917f5e67cf8fb0fa",
      "terminal_status": "completed"
    },
    {
      "artifact_path": "runs/4ad7eb1dcb20a0eb4843b7caadd3aaeb2cbc2d049b4f4a8c56d098a12bd5aff3.json",
      "artifact_sha256": "6b847ab7263de8c6857669c009a6e3f272f287280ba6e394661f2256412962bf",
      "run_id": "sha256:4ad7eb1dcb20a0eb4843b7caadd3aaeb2cbc2d049b4f4a8c56d098a12bd5aff3",
      "terminal_status": "completed"
    },
    {
      "artifact_path": "runs/4af89bb7c855d7beb42a57f1309d854a63994b0da550fe04e1b8473a6442ec68.json",
      "artifact_sha256": "b741ec6d8fe2ebbec0142a551855ed1a7011ca1425ad10335cb1a0c05e32e7e2",
      "run_id": "sha256:4af89bb7c855d7beb42a57f1309d854a63994b0da550fe04e1b8473a6442ec68",
      "terminal_status": "completed"
    },
    {
      "artifact_path": "runs/4ee3b11445e83b3ed892f5d2df5beaead240fb2026f2c078ae56d808375370fb.json",
      "artifact_sha256": "350baf29a04ce19b7b4589fc2e8754966e217436aa2e617b1a0d48c68f2317ae",
      "run_id": "sha256:4ee3b11445e83b3ed892f5d2df5beaead240fb2026f2c078ae56d808375370fb",
      "terminal_status": "completed"
    },
    {
      "artifact_path": "runs/507dc53e44c85eaebd0e3264777c1a4fed33926cf1ab99b8c630f495ac8ff1f9.json",
      "artifact_sha256": "e6bf62862bd42ae1a530f5733ab65ae83185f961864b6e8bca363626d648fd09",
      "run_id": "sha256:507dc53e44c85eaebd0e3264777c1a4fed33926cf1ab99b8c630f495ac8ff1f9",
      "terminal_status": "completed"
    },
    {
      "artifact_path": "runs/5133dbbb510ae44a6b13517b78ed077257dca932bd12148faecb192a6be3842e.json",